{
  "id": "a7e6d378-8cf1-11eb-8dcd-0242ac130003",
  "userId": "b3454b32-8cf1-11eb-8dcd-0242ac130003",
  "dateTime":"2024-01-01T21:34:09.387Z",
  "reportSearchCriteria": {
    "email": "eltonjohn12345@co.uk",
    "driverNumber": "DRIVER1002101212121",
    "startDate": "2024-01-01",
    "endDate": "2024-01-02"
  }
}